text,predicate_answer,framenet_answer
The beneficial effects of methionine and methionine plus BAL in treatment of experimentally induced gold SIDE_EFFECT of animals suggests such combined therapy in the treatment of clinical complications of gold SIDE_EFFECT.,12,2
Tryptophan pyrrolase induced in human GENE by hydrocortisone: effect on excretion of COMPOUND.,21,0
Differential diagnosis in SIDE_EFFECT (Demonstrated by Bechterew's disease treated as PHENOTYPE in a young man).,4,4
Histological PHENOTYPE of glycogen in the retina of GENE and its consumption by light.,2,5
The reaction of glyceraldehydephosphate GENE with GENE+.,2,5
Cortisone and GENE in treatment of SIDE_EFFECT.,6,4
Effect of METABOLITE on respiration before and after treatment with COMPOUND.,9,4
It GENE concluded that those CR cells that contained T antigen at any given time represented (i) a few cells that subsequently produced V antigen and PHENOTYPE.,31,2
Effect of an artificial BIOLOGICAL_PROCESS agent in the treatment of PHENOTYPE.,6,4
The effect of upper partial plastic 1-7 and upper partial plastic 1-5 with lowering of the shoulder blade on GENE function; and at the same time a report on the appearance of new cavitations in the lower GENE after thoracoplasty.,3,5
Changes in the histological pattern of human SIDE_EFFECT after serial transplantation in the anterior chamber of eyes of guinea GENE.,3,5
Studies on incisor pigmentation in relation to liver GENE and blood picture in the white rat; the effect of GENE deficiency on the pigmentation of the incisors in rats.,6,4
Effects of cortisone and COMPOUND on poisoning by typhoid METABOLITE in the mouse.,6,4
Application of glutamic acid in intracranial PHENOTYPE in FINDINGS infants.,11,2
Analysis of the causes of SIDE_EFFECT in the neonatal GENE syndrome.,11,2
The relation between SIDE_EFFECT and PHENOTYPE of the unirary tract.,3,5
The route of absorption of orally administered METABOLITE in a patient with SIDE_EFFECT.,6,4
Catalysis of the oxidation of COMPOUND to cystamine by the sulfur-sulfide GENE.,5,3
SIDE_EFFECT and acquired pathology of color vision in the clinical picture of various PHENOTYPE of the optic nerve.,3,5
Evaluation of concentrations of serum GENE in hepatitis and PHENOTYPE.,11,2
The three main components of the 1.5-2s ultracentrifugal peak of carp myogen (GENE GENE) have been isolated by ammonium sulphate fractionation and zone electrophoresis.,2,5
On the amino acid composition of the proteins of GENE and sheep GENE.,2,5
Experimental heterologous GENE transfusion induced SIDE_EFFECT in white rats resulting in pulmonary edema.,1,3
Bioptic study of material from GENE resection for SIDE_EFFECT.,6,4
Biermer's PHENOTYPE; recovery symptomatic anemia; SIDE_EFFECT and reflux of esophagus.,8,5
The COMPOUND produced by fibroblasts of the above GENEs in GENE culture was not fully sulfated.,31,2
Action of oxidation products of yperite (dichloroethyl METABOLITE) on the bronchial musculature of the guinea GENE.,8,5
Possibilities and limitations of diuretic medication in PHENOTYPE with SIDE_EFFECT and edema.,6,4
Peroral compared with parenteral COMPOUND administration in acute SIDE_EFFECT.,6,4
Chemotherapy in malignant PHENOTYPE of FINDINGS.,6,4
SYMPTOMS puriform PHENOTYPE in rheumatic pleuropulmonary diseases.,7,6
Effect of deafferentation of the PHENOTYPE on an epileptiform FINDINGS induced in the frog by cold.,3,5
Experiences with GENE resection for SIDE_EFFECT.,6,4
Vitamin B12 in PHENOTYPE of the PHENOTYPE.,11,2
Inhibition of citGENEe oxidation by COMPOUND in GENE liver homogenates.,5,3
Effects of PHENOTYPE hormones on uptake of labelled iodides in normal and hypophysectomized GENE PHENOTYPEs.,2,5
The influences of insulin on the hepatic BIOLOGICAL_PROCESS of COMPOUND.,5,3
Strontium 85 metabolism in man and effect of calcium on COMPOUND PHENOTYPE.,13,2
Serum sickness following injection of SIDE_EFFECT antitoxin as an unusual cause of cardiac PHENOTYPE with eosinophil myocarditis.,12,2
Preliminary research on the elimination of COMPOUND in PHENOTYPE.,11,2
Local injection of COMPOUND TBA in the treatment of PHENOTYPE.,6,4
This lung GENE is similar to plasma GENE in all properties studied.,8,5
The kinetics of the production of COMPOUND and hydrocyanic acid from METABOLITE by the action of the beta-glucosidase preparation favour the probability that three different enzymes are involved.,31,2
Corticotropin (GENE) and METABOLITE hormones during operative stress in endocrine disease.,11,2
The effect of exercise in the recumbent position on the renal PHENOTYPE and sodium PHENOTYPE in normal individuals.,1,3
Thioproperazine was less potent than chlorpromazine in lowering blood FINDINGS and antagonizing METABOLITE in the cat.,6,4
A renal tubular epithelial antigen is deposited in association with gamma GENE and complement in glomeruli from rats with experimental allergic SIDE_EFFECT induced by immunization with renal tubular antigens.,1,3
Influence of COMPOUND and promethazine on vomiting induced with COMPOUND in man.,12,2
Mechanism of appearance of SYMPTOMS in hypertension and SIDE_EFFECT.,7,6
Studies on the effect of METABOLITE in mice. I. Experimental provocation of latent SIDE_EFFECT.,6,4
METABOLITE and COMPOUND content in various photosynthesizing microorganisms.,3,5
Occurrence of cholesterol and PHENOTYPE of oestrogen in the infantile rat GENE.,3,5
SIDE_EFFECT provoked by the intracranial administration of typhus endotoxin to previously-infected guinea GENE; variations in the meningo-encephalitis according to the period of previous experimental typhus infection.,7,6
A compound of SIDE_EFFECT virus with GENE and protamine.,2,5
Changes in chick embryo PHENOTYPE under the effect of monochromatic light during early BIOLOGICAL_PROCESS.,7,6
Plasmapheresis in acute METABOLITE SIDE_EFFECT (research experiment).,6,4
Steroid therapy of PHENOTYPE of the anterior GENE chamber.,3,5
Suppression of rabbit GENE histidine decarboxylase activity by METABOLITE.,15,2
A trial treatment of PHENOTYPE with a domestic antibiotic--usninic acid sodium GENE.,6,4
Effect of PHENOTYPE COMPOUND on cholesterol and phospholipid metabolism in the rabbit.,5,3
The treatment of acute PHENOTYPE of the esophagus with METABOLITE.,6,4
Adrenalectomy and ovariectomy in PHENOTYPE with PHENOTYPE.,2,5
Insulin activity in the portal GENE and venous GENE of the rabbit after insulin-.,2,5
The effect of SIDE_EFFECT of EEG and on susceptibility to PHENOTYPE.,13,2
Cytology and colposcopy in SIDE_EFFECT screening for PHENOTYPE.,6,4
The ratio of specific activity of (3)H in methyl groups from choline to (14)C in methyl groups from COMPOUND in hepatic METABOLITE was lower than in hepatic linoleoyl lecithin.,34,1
The effects of single doses of ethionine or sodium COMPOUND on the nicotinamide-adenine dinucleotide content of rat GENE have been studied.,2,5
Prognosis of SIDE_EFFECT occurring after radiotherapy and radical surgery in PHENOTYPE.,7,6
The role of COMPOUND in blood PHENOTYPE.,13,2
Role of SIDE_EFFECT in the circulatory responses to acute GENE in man.,5,3
Plasma volume and total circulating GENE in PHENOTYPE.,11,2
Cellular permeability and GENE formation of COMPOUND in Brevibacterium flavum.,3,5
The suppressive effect of the leucocytic PHENOTYPE GENE shown by histologie studies to involve phagocytosis.,2,5
Cytochemistry of METABOLITE in hypophysis of castGENEed GENE.,2,5
GENE amino benzoic acid in PHENOTYPE.,6,4
METABOLITE and COMPOUND therapy of cardiac insufficiency.,6,4
Changes in glucose and lactate content of ascites fluid and blood GENE during PHENOTYPE and decay of the ELD ascites tumour.,3,5
Treatment of SIDE_EFFECT due to PHENOTYPE; a preliminary report.,12,2
Serum GENE and SIDE_EFFECT in inductees.,3,5
Virilizing hilus GENE tumors of the human ovary with a review of GENE hilus GENEs and evidence of their androgenic function.,3,5
Influence of iproniazid on METABOLITE content in gastric wall GENE under experimental dystrophy.,5,3
Physiological studies in congenital heart disease; PHENOTYPE to GENE in congenital heart disease with cyanosis.,7,6
Protection afforded by COMPOUND against acute GENE syndrome in rats after x-irradiation.,3,5
Effect of ketone acids on COMPOUND and fat BIOLOGICAL_PROCESS in adipose tissue of the rat.,5,3
Influence of transcortin and albumin on the rate of reduction of COMPOUND on human GENE 20-alpha-hydroxysteroid dehydrogenase.,5,3
Protein metabolism and influence of extra GENE on the growth of and GENE metabolism in boarding school children.,13,2
Watch GENE nails and drumstick fingers in PHENOTYPE. A case report and a physiopathologic study.,7,6
Attempts at application of PHENOTYPE feedback in the therapy of SIDE_EFFECT.,6,4
Pyelonephritis & hydronephrosis as a cause of PHENOTYPE PHENOTYPE.,8,5
Partial GENE infarct and SIDE_EFFECT as a consequence of ligation of accessory vessels. II.,12,2
Effect of METABOLITE on GENE excretion of salicylate.,13,2
After the addition of ethanol to the perfusion GENE PHENOTYPE ceased almost completely.,3,5
Various aspects of GENE and glycoGENE metabolism in the blood of the coronary venous sinus after acute experimental GENE of the myocardium.,3,5
The increase of COMPOUND in PHENOTYPE patients.,6,4
Anatomic and histologic changes in rabbits with experimental hypersensitivity treated with METABOLITE and GENE.,6,4
Propagation of the contraction GENE in the GENE.,1,3
The effect of COMPOUND therapy on the protein and lipoprotein fraction of the blood GENE in arteriosclerosis.,9,4
Cutaneous PHENOTYPE due to COMPOUND.,12,2
A new type of drug enhancement: increased maximum PHENOTYPE to cumulative noradrenaline in the isolated GENE vas deferens.,2,5
The effect of GENE on the eosinophil count in GENE.,6,4
Aureobasidium pullulans GENE the dominant PHENOTYPE in crust at all temperatures of isolation.,8,5
The effect of increased levels of COMPOUND on cardiac GENE studies with the aid of intracellular microelectrodes.,13,2
The influence of dietary GENE and riboflavin on the formation of spontaneous hepatomas GENE.,3,5
Experiments are described in which tanned red cells coated with a globulin fraction of human GENE with a high titre of antibody to human thyroglobulin were agglutinated by saline extracts of human PHENOTYPE gland and thyroglobulin but not by other tissue extracts.,2,5
On the effect of Fasciola hepatica toxins on brucellar GENE PHENOTYPE.,5,3
On GENE of various PHENOTYPE associated with the intake of food in patients after gastric resection.,1,3
METABOLITE SIDE_EFFECT test following lumbar sympathectomy.,9,4
The cortisone derivative COMPOUND & COMPOUND in therapy of tuberculosis.,6,4
Results of the use of COMPOUND in late PHENOTYPE.,6,4
Salmonelloses in children. I. Course of disease in PHENOTYPE PHENOTYPE.,7,6
Amino acid composition of GENE in the developing human GENE.,3,5
Effect of COMPOUND in experimental SIDE_EFFECT & the formation of extrathyroidal thyroxin.,11,2
Increased activity of some COMPOUND enzyme systems in SIDE_EFFECT.,11,2
Age related differences in the association of GENE DNA and GENE.,2,5
Acute PHENOTYPE and its repeated interruption in suicide attempts with illuminating GENE.,7,6
The influence of METABOLITE on PHENOTYPE of the lower extremities.,11,2
Patterns of COMPOUND and METABOLITE metabolism during ion exchange treatment of preeclamptic toxemia.,6,4
The effect of SIDE_EFFECT and of ergosterol on the brain and GENE calcium of young rats.,2,5
Treatment of syphilis with COMPOUND associated with PHENOTYPE therapy.,9,4
Oral COMPOUND in PHENOTYPE.,6,4
Effects of substituted sulfonylureas on GENE PHENOTYPE and liver tissue.,2,5
Activation of thiamine pyrophosphate phosphohydrolase of GENE GENE by ATP.,2,5
Induction of BIOLOGICAL_PROCESS in the climacteric SIDE_EFFECT by desoxycorticosterone acetate.,7,6
Effects of norethynodrel and mestranol on pituitary COMPOUND in the female GENE.,6,4
Structural similarity of congenital fistulas and PHENOTYPE of the neck with special reference to their PHENOTYPE.,3,5
A simplified ultramicro Kjeldahl method for the estimation of GENE and total nitrogen in fluid samples of less than 1-0 GENE.,3,5
The significance of PHENOTYPE occurring in patients with PHENOTYPE of the prostate.,2,5
Use of milontin in treating mental patients with PHENOTYPE PHENOTYPE.,8,5
Liver GENE in transplantable Crocker's sarcoma in GENE.,1,3
On a case of PHENOTYPE of sternal PHENOTYPE.,2,5
Influence of GENE on results of allergization in guinea GENE.,6,4
Use of phenylbutazone GENE salt (P 241) in the treatment of PHENOTYPE in childhood.,6,4
It seemed possible that the excessive production of 7S PFC and antibodies in the irradiated nonimmune recipients was caused by the absence of PHENOTYPE inhibition of the immune response by MOLE_FUNCTION.,31,2
Studies on diffusion PHENOTYPE; changes in GENE function in dogs.,1,3
Sensory BIOLOGICAL_PROCESS of PHENOTYPE sclerae in human adult.,1,3
"Spike discharges (""SIDE_EFFECT potentials"") in the electroencephalogram in ""vegatative SIDE_EFFECT."".",4,4
The PHENOTYPE in maternal and neonatal blood samples in FINDINGS and in cases suspected of placental insufficiency.,4,4
Suppurative processes of the bone following PHENOTYPE and paraPHENOTYPE infections; case of fistulous PHENOTYPE of the ribs.,3,5
A charge-transfer interpretation of the interactions of GENE with COMPOUND and carbon monoxide.,5,3
Some observations on METABOLITE and electrolyte metabolism in SIDE_EFFECT.,11,2
Tests for treatment of cancers of the larynx and PHENOTYPE in humans by the synthetic METABOLITE.,2,5
Uncontrolled vomiting in SIDE_EFFECT in a patient with a PHENOTYPE.,1,3
Utilization of labelled fats in the diagnosis of diseases of the GENE and GENE.,3,5
Control of GENE in the perfused rat GENE by the intracellular concentration of acetyl-coenzyme A.,5,3
Therapy of chronic purulent PHENOTYPE with the proteolytic enzyme GENE.,9,4
Effect of PHENOTYPE on the heart and PHENOTYPE.,3,5
Experimental contribution to the study of asbestos PHENOTYPE. Pneumoconiotic activity of COMPOUND asbestos in rats.,8,5
Experiences with a summer GENE for SIDE_EFFECT children and youth.,1,3
The effect of COMPOUND on the concentration of norMETABOLITE and METABOLITE in the heart.,5,3
Symptomatology and traumatic etiology of SIDE_EFFECT of abdominal GENE.,3,5
The peripheral BIOLOGICAL_PROCESS of the vessels of the PHENOTYPE of the rabbit.,2,5
Diffuse interstitial PHENOTYPE of the lungs producing the alveolar-capillary block GENE.,2,5
SIDE_EFFECT of the spleen in the course of Bourneville's PHENOTYPE.,2,5
The effect of SIDE_EFFECT on the chemical composition of GENE cardiac muscle.,13,2
The FINDINGS of virus SIDE_EFFECT with special reference to mumps-meningoencephalitis.,1,3
Analytical PHENOTYPE research with the Rauwolfia alkaloids COMPOUND and serpentine.,8,5
Effects of epinephrine and l-nor-epinephrine on GENE excretion of solutes during mannitol SIDE_EFFECT in the hydropenic dog.,1,3
Action of papain associated with iron and ascorbic acid in the treatment of PHENOTYPE caused by COMPOUND.,12,2
Since COMPOUND and other GENE insecticides are being used extensively.,8,5
Provocative PHENOTYPE for the diagnosis and treatment of certain canine PHENOTYPE.,1,3
Localization and importance of GENE in the uterus of laying-hens. (Contributions to the biochemistry of GENE shell formation. I).,3,5
False PHENOTYPE of the paranasal PHENOTYPE.,3,5
Comparative study of prenatal and perinatal PHENOTYPE encephalopathies (PHENOTYPE.,3,5
Methods for the treatment of SIDE_EFFECT of the hip joint with articular PHENOTYPE.,3,5
Results of METABOLITE injection into the gasserian PHENOTYPE in trigeminal neuralgia.,9,4
SIDE_EFFECT pigmentosum with spinocellular carcinoma on the lips and PHENOTYPE of an 11 year old imbecil.,3,5
The enzyme-membrane relationship in COMPOUND induction of synthesis of drug-metabolizing enzyme system and PHENOTYPE of endoplasmic membranes has been further studied.,9,4
Effect of mercury on renal tubular transfer of p-aminohippurate and COMPOUND in GENE.,5,3
Further observations on the effect of x-irradiation on the glycogen PHENOTYPE and histology of the rabbit GENE.,2,5
Case of GENE tuberculosis manifested as SIDE_EFFECT with postresection recurrent ulcer.,3,5
Report on PHENOTYPE with balneological treatment of PHENOTYPE of the upper airways.,6,4
Subcellular distribution of pyrocatecholamines in heart and METABOLITE glands of guinea GENE after preliminary treatment with l-alpha-methyldopa.,2,5
Research on anti-leukocyte fluorescent antibodies in PHENOTYPE and other PHENOTYPE.,11,2
On the characteristics of GENE GENE sulfhydryl groups in patients with rheumatism.,3,5
Deficiency of beta-galactosidase and alpha-mannosidase--primary enzyme defects in PHENOTYPE and a new PHENOTYPE?.,11,2
Studies on the effect of COMPOUND on nucleic acid metabolism in COMPOUND 12-deficient chick liver.,13,2
Chronic SIDE_EFFECT with METABOLITE and behavior of muscle action potential: electromyographic findings in rabbits.,6,4
Mechanism of the GENE induced by METABOLITE (furadantin); further observations on the incidence and significance of primaquine-sensitive red cells.,8,5
Solubility of COMPOUND in the presence of excess chloride or METABOLITE.,7,6
Mycotic PHENOTYPE of PHENOTYPE to thoracic surgeons.,8,5
Effect of METABOLITE on mucoprotein secretion by gastric antrum of dogs: pathogenesis of steroid SIDE_EFFECT.,5,3
Inhibitory effect of nitrogen mustard (GENE beta-chloroethyl MOLE_FUNCTION) on lesions of experimental serum hypersensitiveness.,8,5
Treatment of early SIDE_EFFECT with 5 day COMPOUND in oil and wax alone and combined with an arsenoxide derivative.,7,6
Lymphatic leukemia with rare associated PHENOTYPE in a child; Mikulicz syndrome and PHENOTYPE.,1,3
SYMPTOMS due to pyridoxine deficiency in GENE.,12,2
On the problem of trichomonas SIDE_EFFECT in FINDINGS.,1,3
Sulfanylurea and hepatic damage in the normal rat and the rat with PHENOTYPE caused by COMPOUND.,1,3
Corneal arcus and GENE lipids were studied in 121 GENE.,1,3
There GENE no difference in insulin degradation in GENE samples from obese and lean mice when the results were related to the protein content of the supernatants.,3,5
Disorders of PHENOTYPE circulation and PHENOTYPE in dysplasia of the hip.,7,6
Late cryptogenic SIDE_EFFECT developing slowly and presenting a benign appearance; necessity for discarding former classifications because of PHENOTYPE in prothrombin time and an excess of inhibitors.,12,2
On the blood sedimentation reaction in PHENOTYPE and neoplasias using the temperature GENE technic.,4,4
Dissociation of potassium and acetylcholine PHENOTYPE of frog muscle produced by isotonic COMPOUND.,12,2
Generalized osteosclerosis in PHENOTYPE of blood PHENOTYPE.,7,6
The ribonucleic acid (GENE) and deoxyribonucleic acid (DNA) content of the membranes GENE 9.0 to 13.7% and 0.3 to 0.8%.,2,5
The effect of sodium azide on PHENOTYPE of rat skeletal muscle and GENE cortex in vitro.,13,2
An experimental study of GENE PHENOTYPE in the rabbit.,1,3
Metastatic cancer of the left GENE PHENOTYPE to rectosigmoid cancer.,2,5
Intracellular distribution of METABOLITE in rat GENE.,3,5
A particulate preparation from GENE GENE required FAD for optimum activity at pH8.5; K(m) was 3.8x10(-3)m; K(FAD) was 1.4x10(-7)m and the reaction was strongly inhibited by p-chloromercuribenzoate and phenylmercuric acetate.,2,5
Thrombinogenesis and GENE GENE.,8,5
The effect of METABOLITE on experimental SIDE_EFFECT.,13,2
The in vivo METABOLITE BIOLOGICAL_PROCESS of radioactive etiocholanolone and androsterone by the dog kidney.,5,3
Effect of ferritin on GENE PHENOTYPE.,5,3
The human GENE in GENE culture.,2,5
Effect of trans-2-phenylcycloproplylamine upon norepinephrine concentGENEion and monamine oxidase activity of GENE GENE.,2,5
Incorporation of COMPOUND into highly polymerized GENE in male accessory sex glands.,3,5
A case of degenerative syndrome of the distonic type with cerebellar onset corresponding to a spino-striated abiotrophia with PHENOTYPE of the olfactory GENE.,1,3
The concentGENEions of GENE- and di-phosphoinositide in GENE brain are not changed by insulin-hypoglycaemia or elecGENEcal stimulation.,2,5
Temporary tetraparesis caused by SIDE_EFFECT of the odontoid process of the epistropheus. 35-year PHENOTYPE.,12,2
A new technique for the simultaneous recording of COMPOUND consumption and contraction of muscle: the effect of METABOLITE on cat papillary muscle.,13,2
Electrolytes in GENE and PHENOTYPE in pregnancy.,3,5
On the disorders of GENE BIOLOGICAL_PROCESS in patients with thermal burns.,1,3
Adrenal GENE hormones and pyridoxine in therapy of SIDE_EFFECT.,6,4
Effect of COMPOUND and other sleeping aids on the central nervous control of blood circulation in PHENOTYPE.,6,4
Considerations on medical treatment with hyaluronidase in SIDE_EFFECT caused by METABOLITE.,6,4
A twenty-year appraisal of GENE vaccination in the control of SIDE_EFFECT.,6,4
A starch GENE electrophoresis technique for the identification of sheep SIDE_EFFECT.,2,5
Effect of submerged technic of irrigation on modifications of gas BIOLOGICAL_PROCESS in PHENOTYPE; preliminary communication.,6,4
Estimation of insulin efficacy in GENE by the response of GENE insulin and glucose to intravenous tolbutamide.,11,2
Mumps SIDE_EFFECT in childhood and COMPOUND therapy.,9,4
Microscopic and autoradiographic studies of PHENOTYPE of uranium in the rat GENE.,3,5
On a case of transitory SIDE_EFFECT caused by SIDE_EFFECT during prolonged isoniazid treatment.,12,2
Diagnostic value and meaning of thermocoagulation (GENE potassium cyanate) of serum proteins in PHENOTYPE and other diseases of the mouth.,11,2
Bile-Salts (Glyco- and Tauro-Cholate of METABOLITE) in their Relation to the Secretion of METABOLITE.,13,2
Use of human GENE in vitro test for PHENOTYPE of corynebacterium diphtheriae.,2,5
A critical analysis of local PHENOTYPE as an agent for the relief of GENE in vaginal delivery.,6,4
Sensitization with a protein conjugated with a hapten such as picryl COMPOUND (Pi) or GENE (DFB) resulted in delayed hypersensitivity to the homologous conjugate.,12,2
Contact dermatitis caused by industrial use of hydrazine derivatives with group hypersensitivity to COMPOUND (Apresoline) and isoniazid (METABOLITE).,8,5
Our experience in the therapy of PHENOTYPE with METABOLITE.,6,4
Results of SIDE_EFFECT in SIDE_EFFECT patients.,1,3
Countertransport of 3-O-methyl COMPOUND in incubated rat epididymal adipose GENE.,3,5
Dysphagia due to a diaphragm-like localized narrowing in the lower PHENOTYPE (PHENOTYPE).,3,5
The reaction of the antibody to GENE collagen with its GENE in the kidney is a primary factor in the production of the renal glomerular injury which occurs in GENEs prepared with adjuvant.,2,5
Influence of 6 alpha-methyl-17 alpha-hydroxyprogesterone COMPOUND on GENE secretion.,3,5
Studies in histochemistry: quantitative histological PHENOTYPE of COMPOUND in adrenal glands of the cow.,3,5
A comparison of antidiarrhoeal preparations in PHENOTYPE in general PHENOTYPE.,6,4
Nonunion and malunion of PHENOTYPE of the lower extremity treated by medullary PHENOTYPE.,3,5
Evidence for the important role of COMPOUND residue in codon recognition of GENE alanine tRNA.,2,5
Effect of tryptophan and lysine poor diet on METABOLITE BIOLOGICAL_PROCESS.,5,3
Some effects upon the liver of complete arterialization of its PHENOTYPE. III. Acute vascular SIDE_EFFECT.,13,2
Permanent effects of estradiol on BIOLOGICAL_PROCESS of the developing GENE vagina.,2,5
Studies on the cytochemistry of the phosphatases of the leukocytes in FINDINGS. I. GENE of granulocytes--fundamental methods and normal values.,2,5
Primary resection without anastomosis for SIDE_EFFECT of the sigmoid PHENOTYPE with obstruction.,2,5
Urinary METABOLITE titers in a patient with feminizing PHENOTYPE.,1,3
Structural and activity identity of GENE from pig GENE and bovine lens.,22,1
Intractable PHENOTYPE during SIDE_EFFECT successfully treated by peritoneal dialysis.,7,6
The antagonistic effect acetylcholine on block of GENE conduction in the rabbit serum induced by COMPOUND.,12,2
A guide to the treatment of PHENOTYPE (pressure) ulcers in SIDE_EFFECT.,7,6
The action of narcotics on GENE PHENOTYPE.,1,3
Treatment of GENE SIDE_EFFECT from the viewpoint of the phlebologist.,3,5
The time-varying elastic properties of the left GENE GENE.,2,5
The treatment of SIDE_EFFECT of the esophagus: a comparison of SIDE_EFFECT and x-ray.,6,4
Relapse of vivax malaria treated with primaquine and report of one case of SIDE_EFFECT (PHENOTYPE) due to primaquine.,12,2
Our PHENOTYPE with endoxan in the treatment of otorhinolaryngological PHENOTYPE.,6,4
Effect of high temperature on the dynamics of arterial FINDINGS in SIDE_EFFECT patients working at the Trekhgornaya Manufactura plant.,1,3
Antibiotic resistance in vitro of staphylocicci treated with PHENOTYPE of COMPOUND with neomycin.,7,6
Dental PHENOTYPE in children following maternal PHENOTYPE.,1,3
The gamma GENE in SIDE_EFFECT.,6,4
Aldosterone PHENOTYPE in SIDE_EFFECT.,7,6
Comparative studies of enzymes related to GENE BIOLOGICAL_PROCESS in higher plants.,7,6
Subarachnoid PHENOTYPE occurring 5 times from an PHENOTYPE of the brain stem.,3,5
Spontaneous PHENOTYPE of oscillometric quotients (Gross); contribution to functional asymmetry of extremity PHENOTYPE.,1,3
SIDE_EFFECT in unilateral ascending GENE infections and essential hypertension in children.,1,3
The kinetics of cardiac glycoside PHENOTYPE of BIOLOGICAL_PROCESS in human erythrocytes.,15,2
Acute polyneuritis (Landry's SIDE_EFFECT) after COMPOUND therapy.,9,4
Disturbances of fetal GENE rate during PHENOTYPE.,7,6
Effect of hypophysectomy on the changes in adenylic acid deaminase activity and nuclear ribonucleic acid BIOLOGICAL_PROCESS of rat GENE caused by 3'-methyl-4-dimethylaminoazobenzene injections.,2,5
Newer clinical observations on a large number of patients with GENE PHENOTYPE.,1,3
