text,predicate_answer,framenet_answer
A comparison of the effect of COMPOUND and growth hormone on the body and organ weights and composition and the arginase and phosphatases of the kidney and liver of the FINDINGS mouse.,22,1
Blood PHENOTYPE in the extremity in acute PHENOTYPE with special reference to the function of arteriovenous anastomoses; studies on unanesthetized dog after carotid ligation.,1,3
A new intramuscular preparation of COMPOUND (COMPOUND).,8,5
It is suggested that the primary function of microtubules in BIOLOGICAL_PROCESS in the Rana pipiens tadpole is the maintenance of GENE shape.,1,3
Studies on the experimental pathogenicity of the lymphocytic choriomeningitis virus. GENE. A directly visible inflammatory reaction in the mouse. Viral PHENOTYPE of the hind leg.,7,6
Hypercholesteremia and SIDE_EFFECT induced in rabbits by purified high fat rations devoid of COMPOUND.,1,3
Acetylmethylcarbinol production and the classification of aeromonads associated with PHENOTYPE PHENOTYPE of ectothermic vertebrates.,11,2
Hydro-electrolytic PHENOTYPE in SIDE_EFFECT.,7,6
A quantitative measurement of the PHENOTYPE caused by PHENOTYPE in dogs.,1,3
The corticoid treatment of bronchial asthma and symptomatic GENE PHENOTYPE.,8,5
The hypothalamo-hypophysial neurosecretory GENE in experimental SIDE_EFFECT in the rat.,1,3
Thin layer chromatography separation and semi-quantitative determination of GENE phenylalanine as procedure for the systematic screening of phenylketonuria in FINDINGS infants.,2,5
It is postulated that the B chain interacts with albumin to enable solubilization of the chain and that inhibition of insulin action on GENE may occur as a result of competition for cellular GENE sites by the B chain.,3,5
Theory of stationary biomasses subject to the action of parasites. Ecology of the nosological GENE of Manson's PHENOTYPE.,8,5
The mycoplasma-like gray lung and rat SIDE_EFFECT agents were indistinguishable in fine structure and location in infected GENE lung.,2,5
High SIDE_EFFECT of the intestine in adult consecutive to PHENOTYPE during fetal life.,1,3
The effect of COMPOUND on alimentary PHENOTYPE.,13,2
Response of the level of acid mucopolysaccharides in GENE granulation tissue to COMPOUND.,2,5
Benign retention GENE; the mechanism of the intermittent GENE in constitutional hepatic dysfunction; with report of a case.,7,6
Primary and PHENOTYPE PHENOTYPE of the ovary.,2,5
The basic peculiarities of viruses of avian PHENOTYPE and PHENOTYPE.,1,3
Characteristics of sodium and COMPOUND excretion in urine of rats with liver GENE.,3,5
The concentration of O2 and of GENE in the venous GENE of patients with arteritis or varices in the evaluation of peripheral circulation?.,3,5
METABOLITE PHENOTYPE in the organism of children with various allergic conditions.,3,5
Indications and contraindications of cardioversion of GENE rhythm PHENOTYPE.,1,3
Hematic PHENOTYPE and PHENOTYPE of the testes.,2,5
Effect of lysergic acid COMPOUND and of its COMPOUND derivative on diuresis in normal dogs and in burns.,11,2
"The ""inversion stage"" of experimental GENE amyloidosis determined by the accelerating effect of nitrogen mustard after various lengths of pretreatment with GENE.",1,3
Remote results of treatment of the arterial SIDE_EFFECT GENE with reserpine.,6,4
Determination of protein-bound iodine in GENE or GENE; a simple and rapid method.,3,5
Observations on treatment of cardiovascular GENE SIDE_EFFECT with aqueous penicillin G.,6,4
Electrophoretic SIDE_EFFECT of acid phosphatases of rat GENE on polyacrylamide gels.,2,5
Plasma copper and PHENOTYPE and plasma para-phenylene MOLE_FUNCTION (plasma copper oxidase activity) in kwashiorkor.,4,4
Progesterone and METABOLITE in cyclical oedema and SIDE_EFFECT.,11,2
Morphology and histogenesis of GENE adenomas appearing in mice after introduction of COMPOUND.,2,5
Studies on PHENOTYPE and leukopenia in PHENOTYPE.,7,6
Effect of COMPOUND on the cortical changes at SIDE_EFFECT of the egg of the medaka.,5,3
METABOLITE as prophylactic agent in PHENOTYPE; further contribution according to data in the literature for 1949-1950.,11,2
Probable existence of new Brucella GENEs with a new scheme proposed for representing GENE PHENOTYPE.,2,5
Atmospheric nitrogen fixation by GENE sulfur bacteria during PHENOTYPE on mineral and organic media.,7,6
Complement-fixing autoantibody to GENE in Hashimoto's PHENOTYPE.,11,2
Etiology and PHENOTYPE of SIDE_EFFECT in pityriasis lichenoides chronica.,7,6
Charcot's joint with PHENOTYPE purulent arthritis treated with intra-arterial COMPOUND.,6,4
SIDE_EFFECT frequency analysis in periodic PHENOTYPE.,4,4
Sulfate uptake in Phallusia mamillata Cuvier. Distribution and fate of sulfate and amino acid COMPOUND in the blood. (Research on hemovanadium. GENE.).,3,5
The effect of METABOLITE on water PHENOTYPE in the rat.,13,2
Influence of desoxycorticosterone and METABOLITE on kidney PHENOTYPE in Addison's disease.,11,2
Association of developing SIDE_EFFECT and malignant GENE neoplasia: clinical radiologic study.,2,5
Dressler's postinfarction GENE resistant to METABOLITE therapy treated with phenylbutazone: clinical case.,9,4
The action of COMPOUND on the phosphorylase activity of guinea-pig atria in vitro and of the guinea-pig GENE perfused according to the Langendorff method.,2,5
Differential effects of COMPOUND on L-alanine and L-leucine incorpoGENEion into GENE pituitary proteins.,5,3
Significance of endogenous COMPOUND in arteriosclerosis; synthesis in arterial GENE.,11,2
Release of gastrin in response to bathing the pyloric SYMPTOMS with COMPOUND.,2,5
Persistent PHENOTYPE in GENE of the monkey associated with Leydig cell hyperplasia induced by gonadotrophins.,3,5
Autonomic responses as a pronostic GENE in chlorpromazine therapy of PHENOTYPE.,6,4
On the use of antibiotics in surgical therapy of PHENOTYPE PHENOTYPE.,6,4
A study of the reaction between human GENE and its homologous equine MOLE_FUNCTION through the medium of light scattering.,2,5
METABOLITE in massive doses and 6-mercaptopurine in the treatment of acute leucemias in adult; possibility of producing successive PHENOTYPE.,6,4
Effects of COMPOUND prophylaxis on the tuberculin response and the local lesion following GENE vaccination of adults.,9,4
Fixed eruption due to COMPOUND and COMPOUND.,12,2
Whereas the maximal rates of gluconeogenesis from COMPOUND and pyruvate were similar in GENE and kidney.,3,5
Multiple PHENOTYPE of the basal GENE type with sudoriparous majority.,3,5
Influence of dietary METABOLITE on incidence of GENE calculi in sheep.,6,4
Modification of alkaline reserve during oxygen therapy of PHENOTYPE with SIDE_EFFECT.,6,4
Leukemia-cell GENE GENE not affect tumor growth under similar conditions.,29,2
Lack of GENE oxidase in yeast cells deficient in METABOLITE.,7,6
Malignancy of PHENOTYPE and PHENOTYPE in patients under 30 years of age.,2,5
Cytological and leukemio-pathological problems concerning the Yoshida GENE (a monocytic PHENOTYPE of the rat).,2,5
Demonstration of MOLE_FUNCTION in the rat kidney and liver: GENE effect of cytochrome C.,5,3
Atrophy of the cerebellum with oculocutaneous and bronchial PHENOTYPE as a familial GENE.,3,5
No direct effects on the duration of the GENE or macromolecular synthesis were demonstrable at a concentration of COMPOUND which completely inhibited mitosis.,15,2
The effect of GENE SIDE_EFFECT on the stomach-emptying time in the rat.,1,3
Histologic evidence for the synthesis of GENE in lymphocytes following parenteral injection of GENE.,3,5
On clinical-anatomical characteristics of SIDE_EFFECT in chronic septic SIDE_EFFECT.,7,6
Oxidative assimilation and PHENOTYPE of COMPOUND in Bacillus cereus.,3,5
Biermer GENE in acute PHENOTYPE.,7,6
The use of total thigh GENE procedure for PHENOTYPE of the hip joint.,6,4
Allergic SIDE_EFFECT in a child associated with PHENOTYPE.,13,2
Sulphur and selenium compounds GENE to acetylCOMPOUND and COMPOUND.,7,6
Malignant SIDE_EFFECT of the anterior GENE wall.,3,5
Retropharyngeal PHENOTYPE due to SIDE_EFFECT.,3,5
Butter yellow (dimethylaminoazobenzene) causes degenerative changes in GENE cells accompanied by PHENOTYPE of cytoplasmic structures that stain with basic dyes because they contain ribonucleic acid.,7,6
Therapeutic influence on the METABOLITE concentration in blood GENE in the course of experimental thrombophlebitis.,3,5
Increase in amount of COMPOUND released from GENE wall under raised luminal pressure.,3,5
Arterial pressure changes in experimental renal SIDE_EFFECT dogs following production of femoral SIDE_EFFECT.,3,5
Activation of GENE by a protein-free aqueous extract of heart GENE.,21,0
Study of some viral strains with unusual PHENOTYPE isolated from various cases of human SIDE_EFFECT.,1,3
Quantitative evaluation of plasmatic and GENE lipids in intact rats treated with METABOLITE.,6,4
Although the patients with severe SIDE_EFFECT GENE as much or more atrophy than the rheumatoid arthritic patients.,1,3
Sulfhydryl content of GENE in rats and guinea pigs treated with METABOLITE or corticotropin.,3,5
Effects of 2-pyridinium aldoxine methochloride and METABOLITE in relation to elevation of GENE pH in soman-poisoned dogs.,6,4
Oxidation of leucine by rat GENE and GENE.,2,5
SIDE_EFFECT of large PHENOTYPE of the jaws.,3,5
Sex differences in SIDE_EFFECT as a clinicostatistical FINDINGS.,11,2
Prolonged postirradiation incubation resulted in a net PHENOTYPE of GENE hexose.,3,5
Observations on the influence of orotic acid on galactose metabolism in GENE PHENOTYPE.,11,2
Therapy of typhoid fever and PHENOTYPE with chloromycetin (COMPOUND).,8,5
Effect of GENE on lipids and glucose in normal and evisceGENEed GENEs and on isolated perfused GENE livers.,5,3
Post-alcoholic SIDE_EFFECT and PHENOTYPE in an African child.,1,3
The syndrome of acute central PHENOTYPE; with special reference to the mechanisms involved in PHENOTYPE of cervical spine.,3,5
Trial of an oral antidiabetic (COMPOUND or GENE).,8,5
Effects of bathing media upon intracellular PHENOTYPE of glycine and upon BIOLOGICAL_PROCESS.,13,2
The use of COMPOUND and COMPOUND in the treatment of edema.,6,4
Biochemical disorders in GENE PHENOTYPE.,7,6
On the dependence of GENE GENE volume.,3,5
A comparison of the effectiveness of COMPOUND and chlorpromazine in SIDE_EFFECT.,22,1
Requirements and tentative mechanism for the interaction between soluble and microsomal ribonucleic acid in GENE GENE.,3,5
The effect of concentration and METABOLITE of exposure to oxygen on the immature GENE eye.,1,3
The pyruvate-oxidase GENE in GENE and the tricarboxylic acid cycle.,3,5
Conversion of COMPOUND to METABOLITE derivative of phenylacetamide.,5,3
Effect of PHENOTYPE hormone on human GENE ribonuclease.,3,5
Effect of combined treatment with COMPOUND and growth hormone on muscle GENE in hypophysectomized female rats.,6,4
Autonomic PHENOTYPE to cerebellar stimulation in the decortiGENEe GENE.,6,4
Inhibition of alcohol dehydrogenase from GENE by COMPOUND.,19,0
Portal gas embolism: a prognostic FINDINGS in PHENOTYPE.,11,2
Combination of COMPOUND & licorice in the treatment of PHENOTYPE.,6,4
Effect of variations in GENE COMPOUND concentration on the susceptibility of mice to pentylenetetrazole (metrazol)-induced seizures.,2,5
Studies on arteriosclerosis and endangitis obliterans. GENE. GENE and adenosine triphosphatase in skeletal muscles in peripheral vascular disorders.,11,2
The failure of COMPOUND to alter the metabolism of METABOLITE in dogs and rabbits.,6,4
The effective GENE resistance and the time constant were measured for the longitudinal muscles of the jejunum and PHENOTYPE.,2,5
Various FINDINGS tumors: treatment with COMPOUND and x-ray therapy.,2,5
GENE PHENOTYPE of the upper jaw.,3,5
The immune response in guinea GENE injected with heterologous and altered homologous GENE.,2,5
Lactic acid content in human venous GENE during GENE at high altitude.,3,5
Effects of adiuretin on SIDE_EFFECT in rats treated with COMPOUND.,1,3
A case of PHENOTYPE (PHENOTYPE).,8,5
The isolated fragment of GENE GENE cortex.,2,5
Estimated hepatic GENE flow and bromsulphalein clearance in dogs with experimental SIDE_EFFECT of the liver.,1,3
Activation of GENE adrenal glucose 6-phosphate dehydrogenase by GENE.,20,0
Specific interference with Coxsackie virus SIDE_EFFECT by the B3-carrier state of HeLa cells was shown to be PHENOTYPE to failure of attachment in the instance of Coxsackie B1 virus.,1,3
Effects of METABOLITE upon COMPOUND consumption and water content of kidney slices.,13,2
Several antibiotics GENE PHENOTYPE of bacteria without killing them when present in the range of concentrations of significance in assaying.,15,2
Studies on the effects of COMPOUND in patients with PHENOTYPE.,13,2
Measurement of gastrointestinal protein loss using GENE labeled with COMPOUND.,2,5
Physiology and pathology of the stored GENE. II. Experimental studies on ferritin and hemosiderin content of the liver and GENE under physiological and pathological conditions.,2,5
Reaction of the GENE of intestinal epithelial cells of the rat to the ingestion of a neutral GENE or GENEty acid.,2,5
GENE or exercise in PHENOTYPE; changes of blood circulation subsequent to training as a basis of exercise therapy.,6,4
Diagnostic and prognostic value of SIDE_EFFECT in PHENOTYPE.,7,6
Mutarotase GENE found in lysed human erythrocytes and in GENE.,3,5
Hemorrhage and SIDE_EFFECT in a loop of the GENE as a result of the uncontrolled use of dicoumarin.,12,2
On a particular aspect of the thoracic complications of hepatic echinococcosis: PHENOTYPE of the perforated cupola in the middle pulmonary GENE.,3,5
Hypotonia of PHENOTYPE in 4 cases of myxedema in GENE; its improvement by dessicated thyroid extract.,1,3
Trial treatment of cardiac edema with METABOLITE and COMPOUND.,9,4
Abscess PHENOTYPE in the pituitary fossa associated with a SIDE_EFFECT.,7,6
We suggest that isometric expansion during SIDE_EFFECT causes a decrease in proximal COMPOUND reabsorption that relinquishes filtrate to a more distal site in the nephron and that this site may retain chloride preferentially when hypochloremia or chloride deficiency is present.,3,5
Reduced nicotinamide-adenine dinucleotide GENE of normal human polymorphonuclear leukocytes has properties that would qualify it as the enzyme responsible for the BIOLOGICAL_PROCESS during phagocytosis.,7,6
Urinary lactic GENE activity in SIDE_EFFECT.,11,2
Protein and water contents in the blood GENE of patients PHENOTYPE from diseases of the chest (pleural empyema.,3,5
The fluoro-derivatives of METABOLITE and UTP behaved like the unsubstituted nucleotides on the goldfish intestine but the main effect of 6-azaUDP and large amounts of COMPOUND and uridine was to cause a relaxation.,3,5
The effect of FINDINGS on electrolyte PHENOTYPE in unanaesthetized dogs.,13,2
Content of adrenaline and METABOLITE in the plasma during hypertension induced with COMPOUND in the dog.,6,4
Studies on the role of COMPOUND in mammalian BIOLOGICAL_PROCESS; preliminary report.,13,2
Determination of GENE and COMPOUND content in the smoke of Italian cigarettes currently on the markt.,7,6
Urinary PHENOTYPE of adrenaline and noradrenaline in response to eserine before and after medullo-adrenalectomy in GENE.,1,3
Results of the study indicated that the complemental use of antacids with each divided dose of steroid is highly effective in reducing the frequency and severity of digestive PHENOTYPE during prednisone and COMPOUND administration.,7,6
Iodination-coupled tetrazonium and ferric ferricyanide reduction stains for differentiating red blood cells GENE fetal or adult GENE.,2,5
The effect of METABOLITE on the oxygen PHENOTYPE of brain tissue.,13,2
Experimental studies on the role of PHENOTYPE chemotherapy for prevention of recurrence and SIDE_EFFECT formation in malignant tumors.,6,4
Chemical transformations of steroids by METABOLITE perfusion; COMPOUND.,8,5
RELATION of vitamin E and GENE to incisor BIOLOGICAL_PROCESS.,3,5
Treatment with METABOLITE of a case of liver cirrhosis associated with PHENOTYPE of the adrenal cortex; syndrome described by Bongiovanni and Eisenmenger.,7,6
Effects of blood serum & human leukocyte extract of PHENOTYPE patients on endothelium in GENE culture.,1,3
Fluorescent MOLE_FUNCTION studies in human SIDE_EFFECT.,11,2
Long-term COMPOUND for SIDE_EFFECT.,6,4
Simplified left transthoracic cervical anastomosis of PHENOTYPE and stomach in the treatment of high and GENE esophageal stenoses caused by caustics.,3,5
Mechanism of PHENOTYPE and accumulation of COMPOUND in Aspergillus niger.,3,5
Three cases of surgical partial plication of the GENE for SIDE_EFFECT.,6,4
Penthrane PHENOTYPE and GENE parenchyma: histologic study on laboratory animals.,9,4
Acute leukosis in a 2-year-old mongoloid with cardiac PHENOTYPE and SIDE_EFFECT of the colon.,3,5
The effects of hadacidin and COMPOUND on hepatic BIOLOGICAL_PROCESS and adenosine triphosphate levels in ethionine-treated rats.,6,4
Quinidine potentiates twitch tension and (at higher concentrations) causes contracture of skeletal muscle whereas the same drug reduces tension PHENOTYPE of GENE.,3,5
Strips of GENE nerve from dorsal roots were immersed in solutions containing COMPOUND cyanide and alpha-dinitrophenol.,2,5
Studies on improved cell preservation. I. On the effect of COMPOUND on erythrocyte BIOLOGICAL_PROCESS. Separation of acid-soluble phosphate and 1st results.,13,2
The action of tetanus toxin on the acetylcholine and GENE contents of the rabbit's GENE.,2,5
Effects of lipids on GENE heart cells in GENE culture.,2,5
Air GENE images in PHENOTYPE.,4,4
The nucleic acid content of GENE and GENE in mammals of different body size.,2,5
The tricuspid and GENE PHENOTYPE in mitral stenosis.,7,6
The bond lengths and angles have been measured and are compared with the dimensions found for GENE thymidylate and METABOLITE.,22,1
"Induction of PHENOTYPE in vitro in hamster kidney tissue by adenovirus 7-SV40 ""GENE"" strain (LLE46).",3,5
The inhibition by acetazoleamide of GENE phosphate-activated GENE in rats.,2,5
Use of intravenous METABOLITE to prevent SIDE_EFFECT.,24,4
Pathogenic activity of COMPOUND in gastric and PHENOTYPE.,3,5
The transmission of left auricular pressure waves to the level of the pulmonary PHENOTYPE in normal dogs & in dogs with PHENOTYPE.,1,3
Results of correction of large GENE wall PHENOTYPE with alloplastic material.,3,5
Sarcoptes PHENOTYPE (Sarcoptes tapiri nov. spec.) in tapirs (Tapirus terrestris GENE.).,1,3
Accumulation of GENE in the gills of Potamon perlatus (M. Edw.) in relation to BIOLOGICAL_PROCESS.,3,5
The participation of ribose derivatives in the conversion of COMPOUND to COMPOUND by extracts of Escherichia coli.,5,3
Late Developments in a Case of Gyrate SIDE_EFFECT of the Choroid and METABOLITE (Fuchs).,3,5
"Control of rhythmic PHENOTYPE of a Neurospora ""clock"" GENE by sugars.",13,2
Latent Monilia & PHENOTYPE in non-pregnant & pregnant women & in FINDINGS.,1,3
Blood-calcium and COMPOUND of the cow in health and PHENOTYPE.,2,5
Effects of COMPOUND on respiration and PHENOTYPE.,13,2
On the mechanism of SIDE_EFFECT. On the specific MOLE_FUNCTION of TMG in E. coli.,1,3
It is proposed that depolarization in response to acetylcholine may be no more than the electrical sign of increased permeability to ions such as COMPOUND and GENE.,8,5
On a case of PHENOTYPE complicated by PHENOTYPE.,18,0
Influence of GENE on growth and viability of transformable GENE streptococci.,13,2
Reduction of GENE cholesterol by COMPOUND dextro-thyroxine.,3,5
Evidence for the existence of an extramitochondrial pathway of METABOLITE synthesis in GENE liver.,3,5
The significance and estimation of GENE PHENOTYPE by strong concentrations of cobalt.,19,0
Further studies on the influence of COMPOUND on GENE activity.,13,2
On the pathogenesis and treatment of SIDE_EFFECT and SIDE_EFFECT in children.,1,3
The question of amino acid requirements for BIOLOGICAL_PROCESS and cell division has been studied in Tetrahymena pyriformis by depriving cells of histidine and COMPOUND at defined stages in the interdivision interval.,1,3
Reactivation of virus with METABOLITE cannot be effected in vitro but is mediated by the host GENE.,2,5
Canicola PHENOTYPE in GENE.,1,3
The causes and avoidance of failure in surgery for chronic PHENOTYPE of the frontoethmo-sphenoid complex of sinuses: with a previously unreported anomaly which produces chronicity and PHENOTYPE.,6,4
Observations comparing the effects of epididymal SIDE_EFFECT at various levels on the mouse testis with those of SIDE_EFFECT.,13,2
The experimental model has many of the features of chronic urinary PHENOTYPE in man and suggests that pyelitis is an important factor in the pathogenesis of PHENOTYPE initiated by retrograde infection.,12,2
Intestinal PHENOTYPE caused by rectal SIDE_EFFECT during brucellosis.,12,2
Enhancement of RNA synthesis in isolated GENE nuclei by METABOLITE.,21,0
Nature of increased GENE beta-globulin content in malignant hypertension and SIDE_EFFECT.,7,6
Neurohormonal mechanisms in emotional PHENOTYPE of BIOLOGICAL_PROCESS.,15,2
