text,predicate_answer,framenet_answer
In the patients with testicular feminization COMPOUND PHENOTYPE by slices of skin obtained from the mons was within the normal range.,2,5
"Controlled clinical METABOLITE of COMPOUND (""Marplan"") in hospital psychiatry.",8,5
Neither ;GENE' nor isocitrate dehydrogenase was increased by thyroxine or thyroxine and COMPOUND in testes.,20,0
Copper PHENOTYPE of the blood GENE in Botkin's disease.,3,5
Rickettsial syndrome of GENE tasters. Apropos of two cases of rickettsia by R. conori observed in one GENE in Auvergne.,1,3
Partial nephrectomy on SIDE_EFFECT for intractable SYMPTOMS.,6,4
"Failure of PHENOTYPE of the ""early protein"" induced by an influenza virus in cells infected by SIDE_EFFECT.",5,3
SIDE_EFFECT and PHENOTYPE of the heart.,3,5
The place of PHENOTYPE spinal fusion in treatment of SIDE_EFFECT of the spine.,6,4
Inhibitory action of COMPOUND upon the reflex bradycardia caused by COMPOUND.,12,2
CLINICAL pathological conference; PHENOTYPE with GENE parenchymal and vascular disease.,2,5
Cases of retinitis pigmentosa and GENE treated with GENE.,6,4
A colorimetric method for transaminase in GENE or GENE.,3,5
Effect of adrenaline and adrenergic blocking agents on the basal COMPOUND consumption of the perfused rat GENE.,2,5
Action of ultra-sounds on various organic fluids; GENE GENE.,3,5
Acute COMPOUND (Doriden) SIDE_EFFECT; the use of bemegride (Megimide) and hemodialysis.,8,5
The influence of GENE and age on SIDE_EFFECT in children and young adults.,1,3
Suppression of BIOLOGICAL_PROCESS in the guinea GENE by bilateral electrolytic lesions of the interstitial latero-dorsal hypothalamic nucleus.,1,3
The effects of acetazolamide and diphenylhydantoin on brain COMPOUND and amino acid BIOLOGICAL_PROCESS.,2,5
METABOLITE therapy of urological PHENOTYPE.,9,4
Certain aspects of action of COMPOUND hydrazine on GENE and myocardial explants cultured in vitro.,3,5
Adrenal PHENOTYPE and PHENOTYPE in nephrosis and diabetic nephropathy.,7,6
Potentiation of smooth surface caries by COMPOUND variously administered to the white GENE.,14,4
Formation and PHENOTYPE of SIDE_EFFECT in the family.,1,3
Potassium COMPOUND attenuation of the histopathologic effect of SIDE_EFFECT on the myocardium of the rat.,13,2
The seminal vesicle as the source of the spermatozoa-coating GENE of seminal GENE.,3,5
Role of PHENOTYPE in the problem of SIDE_EFFECT in industrial workers.,13,2
Effect of roentgen therapy on GENE SIDE_EFFECT.,13,2
"Effect of SIDE_EFFECT factors on ""adrenalin oxidase"" in the blood GENE.",3,5
There is evidence that mucus production is continuous and is accompanied by regeneration of GENE cells and elimination of necrotic cells at the distal GENE.,3,5
Interstitial GENE with iridocyclitis with unilateral predominance in a patient who GENE had congenital syphilis. Complete recovery after 198 million units of penicillin.,3,5
Analysis of the causes of SIDE_EFFECT in the neonatal anoxia GENE.,11,2
Studies on ribonucleic GENE synthesis in nuclei isolated from rat GENE.,3,5
Early recognition of PHENOTYPE and congenital PHENOTYPE of the hip. An evaluation of Shenton's line.,3,5
METABOLITE and electrolyte state in PHENOTYPE.,11,2
Lack of influence of vitamin B12 on GENE catabolic action of METABOLITE.,5,3
Influence of age on rate of PHENOTYPE of sliced GENE.,13,2
Immobilization of Treponema pallidum in vitro by a specific MOLE_FUNCTION produced in SIDE_EFFECT and complement.,12,2
Concealed drainage of the middle GENE of the lung into the superior vena cava through a tributary of the superior pulmonary GENE.,2,5
Changes of electrolyte concentration in GENE and in heart GENE caused by digitalis and their influence on the effect of digitalis.,3,5
Secondary complications caused by compound E and GENE substance ACTH in the treatment of rheumatoid arthritis and other PHENOTYPE.,8,5
Reinforcement of colon anastomoses using COMPOUND foam treated with COMPOUND.,9,4
Studies on pathogenesis and immunity in PHENOTYPE; BIOLOGICAL_PROCESS of the white rat to Bacterium tularense.,7,6
Experimental PHENOTYPE in GENE rats following renal operations.,1,3
It is suggested that the presence of fructose diphosphatase and GENE in white muscle may be GENE to operation of the alpha-glycerophosphate-dihydroxyacetone phosphate and malate-oxaloacetate cycles in this tissue.,7,6
Is it necessary to continue treating hip PHENOTYPE by intraarticular injections of METABOLITE.,3,5
Prevention of PHENOTYPE in rabbit by intravenous microcrystallized estradiol METABOLITE and dextran.,24,4
Modification by imipramine of the bronchodilator PHENOTYPE to isoprenaline in GENE patients.,6,4
A case of Darier's PHENOTYPE with lesions of acrokeratosis verruciformis of the Hopf-type in a father and GENE.,1,3
One-half gram of COMPOUND daily with COMPOUND and PAS used as a re-treatment regimen in pulmonary tuberculosis.,9,4
On the inheritance of poly- and PHENOTYPE in GENE.,3,5
Uric acid production of GENE PHENOTYPE graded amounts of egg protein and yeast nucleic acid.,2,5
The highest frequency of SIDE_EFFECT was found in colonies in which breeding mice are housed in proximity to mice inoculated with polyoma virus or passage PHENOTYPE.,2,5
The effect of GENE temperature on the binding of alkylating agents in the isolation perfusion treatment of PHENOTYPE.,6,4
A rare cause of stricture of PHENOTYPE; SIDE_EFFECT.,3,5
Hemodynamic and PHENOTYPE during operations on the thoracic GENE in experimental conditions.,3,5
Indole as an activator for in vitro PHENOTYPE of GENE fibers in the assembly of bacteriophage T4D.,2,5
METABOLITE PHENOTYPE.,3,5
Optical rotatory FINDINGS of soluble feather GENE.,2,5
Effects of acute and chronic denervation of the hind GENE of the dog on the blood flow responses in the vascular beds of GENE and muscle to adrenergic drugs.,3,5
Capacity of some METABOLITE derivatives to induce BIOLOGICAL_PROCESS and to modify cerebral dopamine.,21,0
Studies on the occurrence in human GENE of GENE fixing antibodies to contagious canine hepatitis virus.,2,5
Isozymes of alanine aminotransferase in the gingiva and GENE of scorbutic guinea GENE.,2,5
The estimation of GENEic gonadotrophin in GENE tissue and urine as a means of early detection of invasive mole and GENE carcinoma.,3,5
Tuberculin type PHENOTYPE to spinal cord antigen in rabbits with isoallergic PHENOTYPE.,13,2
The dose-response relations of COMPOUND in SIDE_EFFECT.,6,4
Changes in hypothalamic luteinizing hormone releasing factor (SIDE_EFFECT) in the female GENE during puberty.,6,4
The early distal COMPOUND concentration in rat GENE after renal ischemia and hemorrhagic hypotension. A contribution on the pathogenesis of the postischemic and posthemorrhagic decrease of the filtrate.,3,5
A study on the virus aetiology of GENE respiratory infections in the primary FINDINGS.,1,3
Serum amylase GENE above normal in five of 27 patients on whom this determination GENE carried out.,3,5
The effect in vivo of thyroxine on acyl GENE GENE liver and muscle.,2,5
Prevention of hormona eosinopenia and lymphopenia by inhibition of SIDE_EFFECT in GENE; preliminary report.,3,5
Effect of secretin and pancreozymin on GENE and alkaline GENE dog's pancreas.,2,5
Calcium and COMPOUND changes in bone associated with continuous administration of stable COMPOUND to rats.,14,4
Differential diagnosis of organic PHENOTYPE and PHENOTYPE in aged patients.,1,3
The relation between the state of the juxtaglomerular apparatus and aldosterone PHENOTYPE in certain diseases characterized by PHENOTYPE.,7,6
Interrelations between thyroxin and METABOLITE in the regulation of oxygen PHENOTYPE in the albino rat.,13,2
Plasma and tissue proteins produced by non-hepatic GENE organs as studied with lysine-epsilon-C14; gamma globulins the chief MOLE_FUNCTION fraction produced by non-hepatic tissues.,2,5
Failure of anti-histaminic drugs to antagonise the anemia produced by GENE plus COMPOUND.,12,2
Conduct of PHENOTYPE and resuscitation in emergency surgery of total hypertensive staphylococcic PHENOTYPE in infants.,1,3
Indications and PHENOTYPE of tracheotomy in PHENOTYPE in children.,1,3
The effect of water by vein on the more severe PHENOTYPE of cardiovascular-renal PHENOTYPE.,13,2
Behavior of cholesterol in the blood and GENE tissue in women treated with diphenesenic GENE during the premenopause and menopause.,3,5
Subcutaneous METABOLITE PHENOTYPE; excision without visible scar.,3,5
Use of the midnight COMPOUND suppression test showed that the plasma 11-hydroxycorticosteroid (11-O.H.C.S.) level did not undergo its normal reduction in 14 out of 27 patients with PHENOTYPE.,1,3
Effect of ether anesthesia and of medicinal BIOLOGICAL_PROCESS on the development of SIDE_EFFECT of the pharyngeal mucosa in rabbits.,1,3
Effect of intravenous COMPOUND on anuria and oliguria associated with the toxemias GENE.,13,2
Role of amino acids in the initiation of hormonal secretion. II. Effects of amino acids on PHENOTYPE and ascorbic acid content of the adrenal glands. Effects of amino acid PHENOTYPE on corticosteroid excretion.,13,2
Studies on central flicker fusion frequency in patients with PHENOTYPE and SIDE_EFFECT stagnatum.,1,3
Radiological aspects of isolated SIDE_EFFECT of intervertebral disk and of posttrumatic SIDE_EFFECT.,3,5
A note on the binding of COMPOUND to GENE diaphragm.,2,5
Effect of COMPOUND and COMPOUND on the bones of bilaterally adrenalectomized female rats.,3,5
Quantitative measurement of GENE GENE by needle biopsy.,2,5
Effect of source and level of dietary GENE on liver enzyme systems in the young GENE.,3,5
Effect of GENE treatment in PHENOTYPE caused by immobilization of extremities.,12,2
Immediate spirocheticidal effect of COMPOUND per os and of three bismuth preparations in PHENOTYPE; action of bismuth propyloldimercaptide.,11,2
Effect of the section of abdominal nerves and removal of the first and second lumbar sympathetic ganglions on the renal PHENOTYPE in PHENOTYPE.,6,4
The use of streptomycin and COMPOUND for infectious SIDE_EFFECT in Turkeys.,1,3
Influence of COMPOUND on the in vitro BIOLOGICAL_PROCESS of glucose in epididymal adipose tissue from mice.,5,3
O2 pressure and O2 saturtion in the determination of COMPOUND loading of the blood with special reference to direct O2 pressure measurements with the stabilized whole GENE platinum electrode.,9,4
Electron microscopic study of the abdominal GENE of the young GENE infected with original swine pox.,2,5
Action of COMPOUND on the thyroid gland of the intact and of the castrated male guinea GENE.,3,5
On the effect of METABOLITE (METABOLITE) and colimycin on dysenterial infection.,8,5
Fate of glucose in isolated GENE spinal cord and diaphragm incubated in the absence and presence of GENE.,2,5
Atelectatic SIDE_EFFECT of the right middle GENE.,3,5
It GENE found that mycelial PHENOTYPE could be circumvented by operational means during continuous culture using the following technique: Two interchangeable 24-liter stages were installed at the front end of the nine-stage system and connected in parallel with the latter.,1,3
Effects of oxytocin on GENE water and salt PHENOTYPE in rats.,1,3
Effect of SIDE_EFFECT and alkalosis on excretion of water and solutes during periods of hydropenia and of overhydration in dogs; current concepts of the mechanism of GENE concentration and dilution.,1,3
The GENE copper coefficient and other factors influencing the serum trace element level in Botkin's PHENOTYPE.,4,4
Hypernatremic hemorrhagic SIDE_EFFECT in GENE.,1,3
Nosographic position of PHENOTYPE; effect of METABOLITE therapy.,9,4
Possibilities of clinical use of COMPOUND in SIDE_EFFECT tuberculosis patients.,6,4
Acute SIDE_EFFECT in a haemophiliac; due to transfusion of incompatible GENE.,1,3
Effect of GENE on membrane potential in frog GENE.,2,5
METABOLITE in the cerebrospinal fluid and GENE of dogs after intravenous administration of hypertonic solutions.,2,5
Development of PHENOTYPE in pitressin therapy of GENE with partial anterior pituitary gland insufficiency.,6,4
New viewpoints in the evaluation of roentgenotherapy of genital carcinoma; reaction of the serous GENE in genital PHENOTYPE.,7,6
On the treatment of stenocardia PHENOTYPE following heart PHENOTYPE.,8,5
Studies on the relationships of postmortem chloride and COMPOUND concentration in cerebrospinal fluid and plasma to the time and cause of SIDE_EFFECT.,3,5
Lactic acid & lactic GENE activity in the blood of patients with SIDE_EFFECT.,1,3
A method for the recovery and use of GENE from the open heart during extracorporeal circulation in GENE.,6,4
Rats were PHENOTYPE ethanol for 2 weeks along with diets either adequate or deficient in GENE and choline.,7,6
Further studies on COMPOUND synthetase-serine deaminase of rat GENE.,2,5
The evidence presented indicates that in its native state in GENE METABOLITE is either bound or its anionic groups are not entirely free.,3,5
A Modified oxidase assay for low concentrations of GENE in GENE and other biological fluids.,3,5
Total GENE PHENOTYPE through a persistent left superior vena cava.,1,3
Therapy of diseases with fever to combat PHENOTYPE and PHENOTYPE.,6,4
The buffering of GENE in PHENOTYPE; protein.,2,5
Optical anisotropy and mechanical BIOLOGICAL_PROCESS of smooth muscle of the longitudinal layer of GENE ileum.,2,5
Azathioprine effect on normal canine GENE and GENE function.,2,5
Changes in plasma glucose level and GENE glutamic oxalacetic transaminase activity in acute PHENOTYPE and inappetence in pigs.,1,3
It is concluded that addition of 0.1mm-ouabain to guinea-pig cerebral cortex slices causes inhibition of either glyceraldehyde 3-phosphate GENE or GENE or both.,19,0
Glucuronides of METABOLITE in hepatic PHENOTYPE (clinical and experimental research).,11,2
Improved PHENOTYPE for histological demonstration of glycogen and comparison with chemical determination in GENE.,3,5
Tissue culture of GENE and PHENOTYPE.,2,5
Rapid PHENOTYPE of GENE in Saccharomyces cerevisiae during gamma irradiation correlated with catalase formation.,3,5
Meningoencephalic PHENOTYPE in SIDE_EFFECT.,7,6
Studies of GENE BIOLOGICAL_PROCESS in three pumping systems used in extracorporeal circulation.,3,5
Advantage of corticoid and antihistaminic PHENOTYPE in the treatment of exogenous PHENOTYPE.,6,4
The acute PHENOTYPE and disposition of GENE (HPL) have been studied in 15 men and 8 women during continuous intravenous infusions.,3,5
Sonne SIDE_EFFECT; a comparison of the duration of SIDE_EFFECT in hospital and general practice.,8,5
SIDE_EFFECT of the appendix simulating PHENOTYPE.,2,5
2 unusual PHENOTYPE in one patient: intraluminal esophageal tumor and PHENOTYPE of the mediastinum.,1,3
On the influence of the extracellular Ca concentration on membrane potential and PHENOTYPE of isolated GENE preparations during graded depolarization.,7,6
Results of the treatment of pulmonary tuberculosis with the preparation napashin with regard to the preservation of METABOLITE PHENOTYPE in bacilli.,3,5
Rare form of PHENOTYPE PHENOTYPE on the scapula.,3,5
Note on the fate of secretin in GENE GENE.,11,2
METABOLITE therapy of PHENOTYPE in children.,9,4
Effect of cortisone and METABOLITE on PHENOTYPE of radioactive potassium in the adrenalectomized rat.,6,4
Use of COMPOUND in surgical PHENOTYPE in gynecology.,8,5
Rupture of SIDE_EFFECT of the spleen in SIDE_EFFECT.,2,5
Since the clinical manifestations in infants with PHENOTYPE or stenosis are almost identical to those associated with the obstructive phase of PHENOTYPE.,1,3
Characteristics of the course of focal PHENOTYPE in patients with PHENOTYPE.,1,3
Clinical PHENOTYPE with COMPOUND therapy.,9,4
Effect of somatotropin (GENE) on the maternal organism during SIDE_EFFECT.,3,5
The effect of tartaric acid upon the hydrolytic and transferase activity of the acid GENE GENE.,2,5
Frozen syphilomatous rabbit PHENOTYPE as source of Treponema pallidum for the immobilization (TPI) test for SIDE_EFFECT.,2,5
The decomposition of serologically specific H substance isolated from pig GENE and human ovarian cyst fluids by an enzyme preparation obtained from Closteridium welchii (GENE.).,2,5
Non-appearance of vascular histogenic reactions of experimental PHENOTYPE in METABOLITE transplants without medullary substance.,3,5
A case of fascioliasis (PHENOTYPE) hepatica with possible pulmonary FINDINGS localization.,8,5
Inhibition of aspartase from the blood GENE of guinea GENE.,3,5
1962.-The PHENOTYPE of type 5 PHENOTYPE in HeLa cells was suppressed to a considerable extent by low concentrations of proflavine.,3,5
Action of Vichy (Grande Grille) METABOLITE on bladder motricity; clinical studies in GENE under cholecystographic control.,6,4
Neither system was influenced by probenecid (benemid) in doses which markedly PHENOTYPE the simultaneous PHENOTYPE rate of p-aminohippuric acid.,13,2
Potentiation of GENE by dimercaptopropanol (GENE) and other inhibitors of its destroying enzyme in plasma.,3,5
The influence of dietary fats on GENE and platelet lipids and ADP induced platelet SIDE_EFFECT in the rat.,1,3
Effects of COMPOUND phenylpyruvate on GENE amino acids.,2,5
The method of fractionated pressure and localization of COMPOUND in hepatic GENE.,3,5
Some unusual clinical features associated with malignant tumors. GENE. On polycythaemia secondary to PHENOTYPE.,12,2
Comparison of the social setting and BIOLOGICAL_PROCESS of patients with PHENOTYPE.,1,3
The effect of METABOLITE on PHENOTYPE; photographic study.,13,2
Tumors of the nose and METABOLITE accessory PHENOTYPE.,2,5
Prevention of amblyopia and restoration of PHENOTYPE in unilateral GENE.,7,6
Plasma disappearance rate and tissue PHENOTYPE of radioactive cobalt labelled METABOLITE injected into various animals.,14,4
Electrolytic precipitation of COMPOUND in the jaw; an unusual PHENOTYPE after root resection.,3,5
Beta-adrenergic effects and their time course under the influence of COMPOUND and METABOLITE on the Langendorff heart.,3,5
Treatment and results in PHENOTYPE in SIDE_EFFECT.,6,4
Critical judgment of the medico-surgical treatment of GENE PHENOTYPE.,2,5
Molecular characteristics of GENE liver GENE.,2,5
The enzymes whGENEch catalyze reactGENEons of METABOLITE occur GENEn three prGENEncGENEple classes: (GENE) oxygen transferases.,5,3
The undiscovered PHENOTYPE of the arteria meningea GENE.,3,5
Physiologic variation of renal function in twins: SIDE_EFFECT after METABOLITE intake.,10,3
Wolff-Parkinson-White's syndrome with COMPOUND sensitivity in a child with PHENOTYPE.,1,3
Reversible change in physical state of GENE induced by GENE ion.,20,0
Long-chain acyl-CoA synthetase in GENE GENE.,2,5
Effect of dilution during fractionation and extraction of GENE and lymph GENE.,2,5
Generalized PHENOTYPE (GENE) in pigs.,1,3
Lessons from GENE COMPOUND studies in Japan.,3,5
Pneumoconiosis: review of 717 cases of GENE PHENOTYPE.,3,5
The short-term BIOLOGICAL_PROCESS of auditory and visual two-channel digits by elderly patients with PHENOTYPE.,1,3
Development of the COMPOUND content of tissues of the fluoroacetate-injected & irradiated GENE.,2,5
Low electrical skin resistance in the region of GENE in GENEful SIDE_EFFECT.,11,2
Congenital PHENOTYPE of the ileum; report of a case with ante-natal PHENOTYPE of the proximal bowel.,3,5
The effect of the main nutrients and GENE on lipoprotein lipase activity in adipose GENE.,3,5
A correlated histochemical and quantitative study on cerebral GENE after SIDE_EFFECT in the rat.,3,5
Effects of acute systemic GENE on the coronary PHENOTYPE and flow in the dog.,1,3
Effects of COMPOUND diuretics on renal tubular transport of PAH and COMPOUND conjugation of PABA.,5,3
Operative treatment of GENE PHENOTYPE of the chest.,3,5
Catecholamines or serotonin did not appear to be key mediators in the primary vascular effect of endotoxin as COMPOUND and COMPOUND administration did not appreciably modify the response.,13,2
Metabolism of COMPOUND by the rabbit GENE.,2,5
Acetabular bone; case of calcified PHENOTYPE of cotyloid PHENOTYPE in adult.,1,3
It hGENEs been shown; (GENE) thGENEt singly isolGENEted GENE explGENEnts were incGENEpGENEble of lymphoid regenerGENEtion.,2,5
Spontaneous PHENOTYPE of PHENOTYPE during jaundice due to virus hepatitis.,7,6
Biological synthesis of oxaloacetic acid from COMPOUND and carbon dioxide: The mechanism of BIOLOGICAL_PROCESS in propionic acid bacteria.,1,3
Paroxysmal SIDE_EFFECT with SIDE_EFFECT and infarction-like changes on electrocardiogram in a 2 1/2 year old child.,1,3
Ligation of the Inferior Vena Cava for Femoral SIDE_EFFECT with Pulmonary SIDE_EFFECT.,6,4
A comparison of some of the properties of the non-sedimentable and the sedimentable hyaluronidase prepaGENEion indicated that there was little difference between the two and that they both resembled lysosomal hyaluronidase from GENE GENE.,3,5
The effect of insulin on GENE metabolism in metabolically healthy and SIDE_EFFECT patients.,1,3
Clinical evaluation of tracheotomy in PHENOTYPE of SIDE_EFFECT.,6,4
Clinical and serological PHENOTYPE in treatment of syphilis with COMPOUND.,6,4
Studies on PHENOTYPE; relationship with sulfonamide SIDE_EFFECT.,1,3
The effect of serum from SIDE_EFFECT patients on the free fatty acid output of rat GENE slices.,1,3
The role of duodenal SIDE_EFFECT in the automatic GENE of the gastric acidity.,3,5
Study of C-reactive protein in PHENOTYPE PHENOTYPE.,11,2
Dynamic studies on COMPOUND and COMPOUND in urine in myopathies.,11,2
Lateral PHENOTYPE as a cause of SIDE_EFFECT.,12,2
Effect of GENE on renal function in isotonic SIDE_EFFECT in weaned rats.,1,3
Attempt to induce formation of PHENOTYPE with METABOLITE.,3,5
Erythroleukemic PHENOTYPE with predominantly erythremic terminal stage: development & PHENOTYPE.,8,5
The modification of intracranial pressure and electrolytes in the cerebrospinal fluid by GENE PHENOTYPE.,19,0
Laboratory investigations during treatment of patients with SIDE_EFFECT and SIDE_EFFECT.,1,3
The eventual degree of sensitivity attained by the animals GENE a resultant of two immunologic processes which occurred independently-tolerogenic effects of escaped chemical on the one hand and on the other the sensitizing effect of the local sensitizing depot of GENE bound in the ear tissue.,5,3
Dislocation of the hip combined with SIDE_EFFECT of the shaft of the femur on the same GENE.,7,6
Effects of METABOLITE (METABOLITE.,3,5
The combined use of COMPOUND and COMPOUND (benzedrine) sulfate in barbiturate intoxication.,11,2
The effect of lipotropic vitamins on PHENOTYPE of the liver in patients with nonspecific ulcerous SIDE_EFFECT.,13,2
SIDE_EFFECT with fatal outcome during oranil therapy of GENE.,6,4
(i) Reducing agents increase the activity of leucoGENE and GENE GENE.,2,5
Simple methods for improving the value of oximetry in the study of GENE oxygen PHENOTYPE.,3,5
Acute SIDE_EFFECT during attempted SIDE_EFFECT by chlorpromazine.,7,6
Determination of GENE (TPN) COMPOUND.,3,5
The use of aminophylline in respiratory depression and COMPOUND retention induced by oxygen inhalation in patients with PHENOTYPE.,1,3
Biopsies of the lung and atrial appendages in PHENOTYPE; correlation of data from GENE catheterization with pulmonary vascular lesions.,4,4
Serious complications of SIDE_EFFECT after SIDE_EFFECT.,10,3
This absorbed GENE still precipitated 140S-ab virus by virtue of still containing MOLE_FUNCTION reactive with the a-determinant site; however.,2,5
Studies on serum GENE (GENE) inhibition by tryptophan metabolities.,3,5
Response of preputial and METABOLITE glands of hypophysectomized rats to GENE.,2,5
The clinical entity of PHENOTYPE crural GENE; report of four cases.,3,5
Investigation of the immunologically active constituent of GENE of patients with SIDE_EFFECT.,2,5
The peripheral utilization of COMPOUND in essential PHENOTYPE.,11,2
The effect of COMPOUND on COMPOUND shock.,13,2
The effect of noradrenalin and angiotensin on kidney function and GENE renin level in a patient with secondary aldosteronism and PHENOTYPE.,1,3
Significance of some intestinal enzymes in duodenal contents and feces for the evaluation of the intestinal activity in chronic SIDE_EFFECT and SIDE_EFFECT.,7,6
Changes in the nitrogen BIOLOGICAL_PROCESS of the apple during the normal and ethylene-induced climacteric rise in rate of PHENOTYPE.,21,0
Content of trace elements in the blood in PHENOTYPE and PHENOTYPE.,11,2
Effect of COMPOUND on water-electrolyte BIOLOGICAL_PROCESS in patients with rheumatic heart disease complicated by circulatory insufficiency.,6,4
Hepatoscintillography with COMPOUND 131-labelled denatured human GENE.,2,5
The excretion of administered sodium COMPOUND by the conscious GENE.,1,3
Effect of alcohol on PHENOTYPE before and after treatment with COMPOUND.,9,4
Radiological aspects of GENE SIDE_EFFECT.,3,5
Changes in eating and BIOLOGICAL_PROCESS produced by partial amygdalar lesions in GENE.,1,3
Content of adrenaline and noradrenaline in the plasma during SIDE_EFFECT induced with COMPOUND in the dog.,6,4
The treatment of some PHENOTYPE with cortisone acetate and GENE.,6,4
Beef GENE esterase as a catalyst of acyl transfer to amino GENE esters.,2,5
Determination of deoxyribonucleic acid content of GENE muscle and myocardial PHENOTYPE in normal rats.,1,3
Case of SIDE_EFFECT treated by ACTH and METABOLITE.,6,4
Electrophoretic distribution of serum protein and GENE in the tuberculous GENE.,3,5
Effect of azo-dye carcinogenesis on enzymes concerned with METABOLITE synthesis in rat GENE.,5,3
Treatment of COMPOUND poisoning with COMPOUND and amiphenazole.,6,4
Results of COMPOUND therapy for PHENOTYPE at Bellevue Hospital.,6,4
Preliminary experiments on the effects of a Rauwolfia serpentina alkaloid (COMPOUND) in hypertension of the lesser PHENOTYPE.,8,5
The vaginal response of the spayed GENE to repeated injections of oestradiol METABOLITE given alone or preceded by progesterone.,14,4
